,,,--- BATCH 1: CLEAR INTENT ---,,,,,,,
,,,,,,,,,,
,query  ,result_1,result_2,result_3,relevance_1,relevance_2,relevance_3,intent,difficulty,reasoning (raw only)
1,best safari in Tanzania,Serengeti safari packages,Tanzania wildlife tours,how to cook rice,High,High,Low,Transactional,Easy,User is searching for safari booking options in Tanzania.
2,weather in Dar es Salaam,Dar es Salaam weather forecast,Tanzania climate overview,football match schedule,High,Medium,Low,Informational,Easy,User wants current weather information.
3,what is machine learning,machine learning definition,introduction to AI concepts,buy laptop online,High,Medium,Low,Informational,Easy,User is seeking explanation of machine learning.
4,cheap hotels in Zanzibar,Zanzibar budget hotels list,luxury resorts Maldives,Zanzibar accommodation deals,High,Low,High,Transactional,Easy,User is looking for affordable accommodation options.
5,YouTube login,YouTube sign in page,YouTube trending videos,Facebook login page,High,Low,Low,Navigational,Easy,User wants to access YouTube account login.
6,how to lose weight,weight loss tips,healthy diet plan,car repair guide,High,High,Low,Informational,Easy,User is looking for health advice.
7,flight to Dubai from Tanzania,Tanzania to Dubai flight booking,Dubai tourism guide,cooking recipes,High,Medium,Low,Transactional,Easy,User intends to book or explore flights.
8,Python programming tutorial,Python beginner course,JavaScript tutorial,Python documentation,High,Medium,High,Informational,Easy,User wants to learn Python programming.
9,nearest hospital in Dar es Salaam,Dar es Salaam hospital locations,health insurance plans,tourist attractions Tanzania,High,Low,Low,Transactional,Easy,User is looking for nearby medical services.
10,buy iPhone 15 price,iPhone 15 online store,Apple product specs,Android phone comparison,High,Medium,Low,Transactional,Easy,User intends to purchase a product
11,best restaurants in Nairob,Nairobi top restaurants list,Kenya food culture,car repair shop,High,Medium,Low,Tranzactional,Easy,User wants places to eat in Nairobi.
12,Facebook login,Facebook sign in page,Facebook news feed,Twitter homepage,High,Medium,Low,Navigational,Easy,User wants to access Facebook account.
13,how to invest in stocks,stock market basics,investment strategies,buy shoes online,High,High,Low,Informational,Easy,User is learning about stock investment.
14,Tanzania visa requirements,Tanzania visa information,travel tips Tanzania,cooking recipes,High,Medium,Low,Informational,Easy,User needs visa information.
15,laptop repair near me,local laptop repair shops,how to fix laptop yourself,buy new laptop,High,Medium,Low,Transactional,Easy,User wants repair service options.
16,Instagram app download,Instagram download page,Instagram features,Snapchat download,High,Medium,Low,Navigational,Easy,User wants to download Instagram app.
17,best beaches in Zanzibar,Zanzibar beach guide,Tanzania national parks,Maldives beaches,High,Low,Low,Informational,Easy,User is exploring beach destinations in Zanzibar.
18,exchange rate USD to TZS,USD to TZS current rate,currency conversion tools,stock market news,High,High,Low,Informational,Easy,User wants currency conversion information.
19,book safari Tanzania,Tanzania safari booking,wildlife photos,safari clothing tips,High,Low,Low,Transactional,Easy,User wants to book a safari.
20,Google maps,Google Maps website,map directions tool,Bing maps,High,High,Medium,Navigational,Easy,User wants to access Google Maps.
21,how to cook rice,rice cooking steps,food recipes blog,car maintenance guide,High,Medium,Low,Informational,Easy,User wants instructions on cooking rice.
22,book hotel in Nairobi,Nairobi hotel booking,Kenya travel guide,airline tickets,High,Medium,Medium,Transactional,Easy,User wants to book accommodation in Nairobi.
23,Twitter login,Twitter sign in page,Twitter trends,Instagram homepage,High,Medium,Low,Navigational,Easy,User wants to access Twitter account.
24,best laptops 2025,top laptops list,laptop reviews,phone comparison,High,High,Low,Informational,Easy,User is comparing laptops before purchase.
25,currency exchange near me,nearby exchange offices,forex rates,online shopping,High,Medium,Low,Transactional,Easy,User wants a nearby currency exchange service.
26,learn python online,Python courses,programming tutorials,cooking classes,High,High,Low,Informational,Easy,Reasoning: User wants to learn Python programming.
27,safari cost Tanzania,Tanzania safari pricing,budget travel tips,wildlife photos,High,Medium,Low,Transactional,Easy,User is evaluating safari costs.
28,Google translate,Google Translate website,translation tools,dictionary app,High,High,Medium,Transactional,Easy,User wants to access translation tool.
29,best time to visit Zanzibar,Zanzibar travel seasons,weather patterns,hotel booking sites,High,High,Low,Informational,Easy,User is planning travel timing.
30,buy shoes online,online shoe store,fashion websites,shoe cleaning tips,High,High,Low,Transactional,Easy,User wants to purchase shoes online.
31,nearest ATM,ATM locator,bank branches,credit card offers,High,High,Low,Transactional,Easy,User wants a nearby ATM location.
32,email login,email sign in page,email inbox tips,social media apps,High,Medium,Low,Navigational,Easy,User wants to access email account
33,how to start a business,business startup guide,entrepreneurship tips,job listings,High,High,Low,Informational,Easy,User is learning how to start a business.
34,download WhatsApp,WhatsApp download page,WhatsApp features,Telegram download,High,Medium,Low,Navigational,Easy,User wants to install WhatsApp.
35,best safari parks Tanzania,Tanzania national parks list,Serengeti guide,Kenya safari parks,High,Medim,Medium,Informational,Easy,User is exploring safari destinations.
36,book flight to Nairobi,Nairobi flight booking,airline ticket deals,travel blog Kenya,High,High,Medium,Transactional,Easy,User wants to book a flight to Nairobi.
37,what is artificial intelligence,AI definition,machine learning basics,buy AI software,High,High,Low,Informational,Easy,User is seeking a definition and understanding of AI.
38,nearest police station,nearby police stations,emergency contact numbers,news articles,High,High,Low,Transactional,Easy,User wants to find a nearby police station for immediate need
39,Spotify login,Spotify sign in page,Spotify playlists,Apple Music homepage,High,Medium,Low,Navigational,Easy,User wants to access their Spotify account.
40,best universities in Africa,top African universities ranking,university admission guide,job opportunities abroad,High,Medium,Low,Informational,Easy,User is researching universities in Africa.
,,,,,,,,,,
,,,,,,,,,,
,,,,,,,,,,
,,,--- BATCH 2: MIXED INTENT ---,,,,,,,
,🔹 Travel & Local Intent (real-world ambiguity),,,,,,,,,
1,best safari companies in Tanzania,Serengeti safari packages Tanzania,Top safari operators Tanzania reviews,Cheap flights to Kenya,Medium,High,Low,Transactional,Medium,User is searching for safari booking options in Tanzania
2,safari packages Serengeti vs Ngorongoro,Serengeti vs Ngorongoro comparison guide,7-day Tanzania safari itinerary,Zanzibar beach resorts,High,Medium,Low,Transactional,Medium,User is comparing National parks so that he/she can visit one.
3,cheapest way to travel Zanzibar,Ferry from Dar es Salaam to Zanzibar price,Budget flights to Zanzibar deals,Luxury Zanzibar hotels,High,High,Low,Transactional,Medium,User is s comparing cheap transport options in Zanzibar
4,things to do in Dar es Salaam at night,Nightlife in Dar es Salaam guide,Best restaurants Dar es Salaam,Tanzania weather forecast today,High,High,Low,Informational,Medium,User wants to find out about night activities in Dar es salaam
5,hotels near Zanzibar beach,Beach hotels in Zanzibar booking,Zanzibar accommodation listings,Kenya safari travel guide,Medium,High,Low,Transactional,Medium,User wants to book a hotel ner Zanzibar Beach.
6,how much is a safari in Africa,African safari cost breakdown (budget vs luxury),Serengeti safari packages pricing guide,Cheap flights from Europe to Asia deals,High,High,Low,Transactional,Medium,User wants to compare safari costs Africa
7,Tanzania travel safety tips,Tanzania travel safety guide for tourists,Crime statistics in East Africa overview, Best safari companies in Tanzania,High,High,Low,Informational,Medium,User wants to find out about tourist safety in east Africa
8,best time to go on safari East Africa,Best months for safari in Kenya and Tanzania,Serengeti migration calendar guide,Zanzibar beach resort deals,High,High,Low,Transactional,Medium,User wants to find out about best months to visit Kenya and Tanzania so as to book a safari
,,,,,,,,,,
,🔹 Tech / Product Comparison Intent,,,,,,,,,
9,best laptop for programming students,Best programming laptops for students guide,Laptop comparison for coding and software development,Cheap laptop deals for gaming accessories,High,High,Low,Transactional,Medium,User wants to find out best laptops for programing with the intent of purchasing one.
10,MacBook vs Dell for university,MacBook vs Windows laptops for students comparison,Best laptops for university students engineering,MacBook repair price guide,High,Medium,Low,Informational,Medium,User wants to compare between mac book and dell laptops.
11,cheap smartphones under 200 dollars,Budget smartphones under $200 list 2025,Best Android phones under 300 dollars,Cheap phone accessories online store,High,High,Low,Transactional,Medium,User what to find cheap smartphones with the intent of buying one.
12,is iPhone 15 worth it,iPhone 15 features and specifications review,Is iPhone 15 worth buying in 2025,Android vs iPhone comparison guide,High,High,Low,Transactional,Medium,User wants to find out if I phone 15 is worthy buying so as to buy it.
13,best Android phones 2025,Best Android phones 2025 rankings,Top smartphone brands comparison,Phone camera accessories for smartphones,High,Medium,low,Informational,Medium,User wants to compare android smartphones
14,laptop specs for coding,Laptop specifications for programming guide,Minimum specs for coding and software development,Best laptops for gaming performance,High,High,Low ,Transactional,Medium,User wants to find out specifications for a coding laptop so that he can buy one
15,how to choose a gaming laptop,How to choose a gaming laptop guide,Best gaming laptops 2025 list,Gaming laptop cooling systems explained,High,Low,Medium,Transactional,Medium,User wants to know the process of choosing a gaming laptop
16,fastest phone processor,Fastest smartphone processors 2025 ranking,Mobile chipset comparison Snapdragon vs Apple,Best budget phones performance test,HIgh,High,Medium,Informational,Medium,User wants to know which smartphone processor is the fastest
,,,,,,,,,,
,🔹 Financial / Decision-Making Intent,,,,,,,,,
17,how to start investing in stocks,How to start investing in stocks beginners guide,Stock market basics and investment strategies,Buy luxury watches online,High,High,Low,Informational,Medium,User wants to learn how to start investing in scok markets and begin investing
18,best banks in Tanzania,Top banks in Tanzania comparison,Bank account types and services Tanzania,Best investment platforms worldwide,High,Medium,Low,Transactional,Medium,User wants to find out the best bank in tanzania with the intent of joining it.
19,money transfer from Tanzania to USA,International money transfer services Tanzania to USA,Send money abroad fees comparison,Cryptocurrency trading platforms,High,High,Low,Transactional,Medium,User wants to find out how to to send money to the USA with  the intent of sending money.
20,how to save money fast,How to save money fast tips,Budgeting and personal finance guide,Online shopping deals,High,High,Low,Informational,Medium,User wants to know how to save money fast with the intent of starting to save
21,forex trading beginners guide,Forex trading for beginners tutorial,How forex market works explained,Stock trading apps comparison,High,High,Medium,Informational,Medium,user wants to find out how to trade forex so he can start do so as a beginner
22,is crypto safe to invest in,Is cryptocurrency safe to invest in guide,Crypto risks and benefits explained,Best forex brokers list,High,High,Low,Informational,Medium,User wants to know if crypo is safe to invest in
23,best side hustles online,Best online side hustles 2025,Freelancing platforms comparison,Online casino games,High,High,Low,Transactional,Medium,user wants to know the best side hustle online with the intent to start hustling so as to earn extra money.
,,,,,,,,,,
,🔹 Learning / Informational with action overlap,,,,,,,,,
24,learn Python step by step,Learn Python step by step tutorial for beginners,Python programming course online free,Java programming basics guide,High,High,Medium,Informational,Medium,"User wants to know how, where to learn python step by step"
25,best coding bootcamp online,Top online coding bootcamps 2025 comparison,Best programming courses online,Free YouTube coding tutorials,High,High,Medium,Transactional,Medium,User is comparing coding bootcamp services with the intent of joining one
26,how to become data analyst,How to become a data analyst roadmap,Data analyst skills and tools guide,Data science salary statistics,High,High,Low,Informational,Medium,User wants to learn the process of becoming a data analyst.
27,AI tools for beginners,AI tools for beginners list,Best AI software for productivity,Advanced machine learning algorithms research,High,High,Low,Transactional,Medium,User wants to find AI tools for bigginers so that he can use them.
28,what is machine learning used for,Applications of machine learning in real life,Machine learning examples and use cases,Buy AI software online,High,High,Low,Informational,Medium,User wants to know the use of Machine Learning
29,digital marketing explained simply,Digital marketing basics explained,Online marketing strategies guide,Social media advertising tools,High,High,Low,Informational,Medium,user wants to learn about digital marketing
30,how to build a website,How to build a website step by step,Website builders comparison (WordPress vs Wix),Web hosting services pricing,High,Medium,Low,Informational,Medium,User wants to know the steps followed to build a website
,,,,,,,,,,
,🔹 Daily Life / Local Search Ambiguity,,,,,,,,,
31,nearest hospital in Dar es Salaam,Nearest hospitals in Dar es Salaam list,Emergency hospitals near me Dar es Salaam,Health insurance plans Tanzania,High,High,Low,Transactional,Medium,User want to know where the nearest hospital is with the intent to go there
32,ATM near me,ATM locations near me,Bank branches near me,Credit card offers Tanzania,High,High,Low,Transactional,Medium,"User wants to find an ATM nearby, with the likely intent of going there."
33,best restaurants in Nairobi,Top restaurants in Nairobi list,Best places to eat Nairobi reviews,Kenya travel guide,High,High,Low,Transactional,Medium,User wants to find out where the best restaurant in Nairobi i with the intent of going
34,cheap food delivery apps,Food delivery apps with cheapest fees,Best food delivery services comparison,Online grocery shopping websites,High,High,Low,Transactional,Medium,User wants to identify a cheap food delivery app so as to order their services
35,pharmacy open now near me,Pharmacies open now near me,24-hour pharmacies Dar es Salaam,Online medicine delivery services,High,High,Low,Transactional,Medium,User wants to know where the Pharmacy nearest him so that he can visit it.
36,taxi services in Zanzibar,Taxi services in Zanzibar booking,Zanzibar transport options guide,Car rental services Zanzibar,High,Medium,Medium,Transactional,Medium,User wants to find out about taxi services in Zanzibar in order to get a texi.
,,,,,,,,,,
,🔹 Vague / Intent-unclear (important for QA skill),,,,,,,,,
37,best way to learn fast,Study techniques to learn faster,Memory improvement tips and tricks,Online courses platforms,High,High,Low,Informational,Medium,User wants to know best ways to learn fast so as to use them in learning.
38,best options for travel,Best travel destinations 2025,Travel planning tips guide,Flight booking websites,High,High,Medium,Informational,Medium,User wants to know best traveling options available
39,cheapest solution for business setup,Low-cost business startup ideas,Business registration process guide,Enterprise software solutions,High,Medium,Low,Informational,Medium,User wants to find out about the cheapest business setup solution
40,good places to invest money,Best investment opportunities 2025,Stock market investment options,Real estate properties for sale,High,High,Medium,Informational,Medium,User wants to find out about good places to invest money
,,,,,,,,,,
,,,,,,,,,,
,,,,,,,,,,
,,,--- BATCH 3: AMBIGUOUS & COMPARATIVE QUERIES ---,,,,,,,
,,,,,,,,,,
1,best safari experience Africa,luxury African safari experiences guide,best national parks in Africa safari,cheap flights to Africa deals,High,Medium,Low,Informational,Hard,User is trying to get information so as to compare safari experiences prior to booking.
2,Serengeti or Maasai Mara which is better,Serengeti vs Maasai Mara safari comparison,Maasai Mara tour packages Kenya,Tanzania travel visa requirements,High,Medium,Low,Informational,Hard,User is trying to get information so as to compare the two national parks.
3,Zanzibar vs Maldives holiday,Zanzibar vs Maldives comparison guide,best Zanzibar beaches list,Maldives luxury resorts booking,High,Medium,Low,Informational,Hard,User is looking for comparison information about the two destination.
4,is Tanzania safe for solo travel,Tanzania solo travel safety tips,crime rates in East Africa,report lost passport abroad,High,Medium,Low,Informational,Hard,"User is trying to find out is it is safe for a solo traveler to visit Tanzania, infpormation preior to booking, but booking depends on answer. "
5,things to do in Zanzibar for couples,romantic things to do in Zanzibar,Zanzibar honeymoon packages,best restaurants in Zanzibar,High,Medium,Medium,Informational,Hard,User is trying to find out activities for couples in Zanzibar with the intent of doing what he/she likes out of the available activities.
6,how much does a luxury safari cost,luxury safari cost breakdown Africa,top luxury safari lodges Tanzania,budget travel tips Africa,High,Medium,Low,Informational,Hard,User is trying to find out the cost of a luxury safari with the intent of booking one.
7,when to visit Serengeti migration,Serengeti migration best time guide,Great migration calendar Tanzania,Zanzibar weather today,High,High,Low,Informational,Hard,"User is trying to get information about the best time for the great migration. he is looking for when, so decision to book and go has already been made"
8,best places to visit in East Africa,top tourist destinations East Africa,Kenya safari packages,cheap flights to Dubai,High,Medium,Low,Informational,Hard,User is trying to gather information about best places to visit in Africa
9,best laptop for university students 2025,best laptops for students 2025,list of affordable student laptops,laptop repair services near me,High,High,Low,Transactional,Hard,User is looking for information about Univerity students laptops prior to buying one
10,MacBook Air vs Pro for coding,MacBook Air vs Pro comparison for developers,best laptops for programming students,iPhone accessories store,High,Medium,Low,Informational,Hard,User is comparing two macbooks to find out which one is better for coding.
11,cheap gaming laptop under 1000,best budget gaming laptops under $1000,gaming laptop performance comparison,gaming chairs online shop,High,Medium,Low,Transactional,Hard,User is trying to find out about cheat laptops under 1000
12,is Samsung better than iPhone,Samsung vs iPhone comparison guide,best Android phones 2025,mobile phone repair services,High,Medium,Low,Informational,Hard,User is trying to get comparison information between Sumsung and Iphone
13,best phone for photography 2025,best camera phones 2025,top smartphones for photography,photo editing software tools,High,High,Low,Informational,Hard,User is gethering information about the best phone for photography
14,what laptop do programmers use,best laptops used by developers,programming laptop specs guide,learn coding online free,High,Medium,Low,Informational,Hard,User is trying to find out the laptop whidely used by programmers
15,gaming laptop vs normal laptop,difference between gaming and regular laptops,best gaming laptops 2025,computer repair services,High,Medium,Low,Informational,Hard,User is trying to get information comparing between gaming laptops and normal laptops
16,which processor is best for gaming,best processors for gaming 2025,CPU performance comparison guide,best gaming monitors,High,High,Low,Informations,Hard,User is trying to get informationa about the best processor for gaming
17,how to invest money for beginners,beginner investment guide,stock market basics explained,buy cryptocurrency online,High,High,Low,Informational,Hard,User is trying to get information on the process of investing mponey as a biginner
18,best way to send money internationally,international money transfer services,compare transfer fees worldwide,open bank account online,High,High,Low,Informational,Hard,User is looking for information on the best way to send money internationally.
19,is forex trading profitable,forex trading risks and benefits,how forex market works,best forex brokers list,High,Medium,Low,Informational,Hard,User wants to find out if forex trading is profitable
20,how to make money online 2026,ways to make money online 2026,best freelance platforms,online casino websites,High,Medium,Low,Informational,Hard,User wants to find information on how to make money online
21,best investment options in Africa,top investment opportunities Africa,real estate investment Africa,how to save money tips,High,Highh,Low,Informational,Hard,User is looking for information on best investment oportunities in Africa
22,how to budget salary effectively,budgeting tips for beginners,personal finance management guide,best banking apps,High,High,Low,Informational,Hard,User is trying to find information on how to budget salary effectively
23,is cryptocurrency a good investment,crypto investment pros and cons,Bitcoin price prediction 2026,best crypto exchanges,High,Medium,Low,Informational,Hard,User if trying to find out if crypocurency investment is good investment.
24,how to start a small business online,steps to start online business,ecommerce business guide,best website builders,High,High,Low,Informational,Hard,User is looking for information on how to start a business online
25,learn data science from scratch,data science learning roadmap,beginner data science courses online,data science salary statistics,High,High,Low,Transactional,Hard,User wantr to find out ways to learn data science from scratch with the intent of doing so.
26,best online courses for programming,top programming courses online,free coding tutorials YouTube,online degree programs,High,High,Medium,Infromational,Hard,User want to know the best online courses for programming
27,how long does it take to learn Python,time to learn Python for beginners,Python learning roadmap,best laptops for coding,High,Medium,Low,Informational,Hard,User what to know the time it would take to learn python
28,AI tools everyone should know,popular AI tools list 2025,best AI tools for productivity,advanced AI research papers,High,High,Low,Informational,Hard,User wants a list of  AI tools everyone should know.
29,what can you do with coding,applications of programming skills,career paths in software development,gaming apps download,High,High,Low,Informational,Hard,User wants information on activities/applications of coding
30,how to learn faster and remember,study techniques and memory tips,how to improve learning speed,best online courses platforms,High,High,Low,Informational,Hard,User wants to know ways to learn fater and remember what you learned.
31,build website without coding,no-code website builders guide,Wix vs WordPress comparison,web hosting services pricing,High,Low,Low,Informational,Hard,User wants ways to build a website without coding
32,how to become a freelancer,freelancing guide for beginners,best freelance websites,remote jobs listings,High,High,Medium,Informational,Hard,User wants information on how to become a freelancer
33,best hospital in Dar es Salaam,top hospitals in Dar es Salaam,private hospitals Tanzania list,health insurance providers,High,Medium,Low,Informational ,Hard,User wants to know the best hospitals in Dar es salaam
34,ATM machines near me,open ATM locations nearby,bank branches near me,mobile banking apps,High,High,Low,Transactional,Hard,User wants to find out the the location of a nearby ATM machine
35,places to eat near me,best restaurants nearby,food delivery apps list,cooking recipes blog,High,Medium,Low,Transactional,Hard,User wants to know places  near him where food is available.
36,cheap transport in Zanzibar,Zanzibar transport options guide,taxi services Zanzibar price,car rental Zanzibar,High,High,Medium,Transactional,Hard,User wants to know cheat transport in zanzibar with the intetion of booking.
37,pharmacy open 24 hours near me,24 hour pharmacies near me,emergency pharmacy locations,online medicine delivery,High,High,Low,Transactional,Hard,User wants to know 24  hour open pharmacies nearby so tat he/she can go.
38,how to get around Dar es Salaam,Dar es Salaam transport guide,best taxi apps Tanzania,flight booking sites,High,High,Low,Informational,Hard,"Informational, user is looking for informational on How to get around in dar es salaam"
